,model,colours,ratings,reviews,selling_price(Rs),actual_price(Rs),off(%),connectivity,brand,type,colour,discount
190,HRX X-Streak 2Q Wired Headset,"Blue, In the Ear",3.7,80,396,591,33,Wired Headset,HRX,In the Ear,Blue,195
191,OPPO MODEL 009 WIRED HEADSET Wired Headset,"White, In the Ear",3.5,327,169,889,81,Wired Headset,OPPO,In the Ear,White,720
192,ViVO High Bass Earphones Noise Isolating Wired Headset,"White, In the Ear",3.4,2631,165,971,83,Wired Headset,ViVO,In the Ear,White,806
193,ViVO HANDSFREE_20 Wired Headset,"White, In the Ear",3.6,4711,194,497,61,Wired Headset,ViVO,In the Ear,White,303
194,Mivi DuoPods M80 True Wireless Bluetooth Headset with a...,"Blue, True Wireless",4.0,1489,2999,5998,50,,Mivi,True Wireless,Blue,2999
195,JBL T210 Wired Headset,"Black, In the Ear",4.1,11007,959,1199,20,Wired Headset,JBL,In the Ear,Black,240
196,boAt Rockerz 261 Bluetooth Headset,"Raging Red, In the Ear",4.1,21897,1199,4796,75,Bluetooth Headset,boAt,In the Ear,Raging Red,3597
197,ORAIMO OEP-E21 Wired Headset,"Black, In the Ear",3.9,1168,289,578,50,Wired Headset,ORAIMO,In the Ear,Black,289
198,SONY XB55AP Wired Headset,"Blue, In the Ear",4.4,18488,2199,2471,11,Wired Headset,SONY,In the Ear,Blue,272
199,SONY WI-XB400 Extra Bass Wireless Stereo Headset Blueto...,"Blue, In the Ear",4.1,2041,3990,4988,20,,SONY,In the Ear,Blue,998
200,OPPO 3.5mm-Jack Wired Headset,"White, In the Ear",3.5,3310,199,995,80,Wired Headset,OPPO,In the Ear,White,796
201,SONY EX255AP Wired Headset,"Black, In the Ear",4.2,2695,1699,1976,14,Wired Headset,SONY,In the Ear,Black,277
202,Boult Audio AirBass Probuds Bluetooth Headset,"White, True Wireless",3.8,5577,1799,7822,77,Bluetooth Headset,Boult,True Wireless,White,6023
203,SONY WI-C200 Bluetooth Headset,"Black, In the Ear",4.1,4626,2290,2974,23,Bluetooth Headset,SONY,In the Ear,Black,684
204,Portronics Harmonics 230 Bluetooth Headset,"Black, In the Ear",4.2,29,799,1998,60,Bluetooth Headset,Portronics,In the Ear,Black,1199
205,boAt 103 Wireless Bluetooth Headset,"Mint Green, In the Ear",4.0,24728,1990,3980,50,Bluetooth Headset,boAt,In the Ear,Mint Green,1990
206,Portronics POR-678 Conch Beta Wired Headset,"White, In the Ear",4.1,8498,379,592,36,Wired Headset,Portronics,In the Ear,White,213
207,JBL LIVE200BT Wireless In-Ear Neckband Bluetooth Headse...,"Blue, In the Ear",3.7,4603,3199,5244,39,,JBL,In the Ear,Blue,2045
208,SONY XB450AP Wired Headset,"Black, On the Ear",4.3,9485,2099,2469,15,Wired Headset,SONY,On the Ear,Black,370
209,Portronics POR-927 Harmonics 200 Wireless Stereo Blueto...,"Black, In the Ear",4.2,3441,2099,2999,30,,Portronics,In the Ear,Black,900
210,boAt Rockerz 370 Bluetooth Headset,"Gregarious Green, On the Ear",4.2,13070,1399,2498,44,Bluetooth Headset,boAt,On the Ear,Gregarious Green,1099
211,Boult Audio AirBass LiveBuds Bluetooth Headset,"Red, True Wireless",3.7,3332,1299,8660,85,Bluetooth Headset,Boult,True Wireless,Red,7361
212,boAt Rockerz 600 HD Sound Bluetooth Headset,"Brown, On the Ear",4.3,19790,1999,3920,49,Bluetooth Headset,boAt,On the Ear,Brown,1921
213,JBL Quantum 100 Wired Gaming Headset,"Black, On the Ear",4.1,329,2599,3998,35,Gaming Headset,JBL,On the Ear,Black,1399
214,JBL T500BT Bluetooth Headset,"Blue, On the Ear",4.3,2731,2940,3769,22,Bluetooth Headset,JBL,On the Ear,Blue,829
215,Sony MDR-AS210 Open-Ear Active Sports Headphones,Blue,4.1,17224,879,888,1,Sports Headphones,Sony,,,9
216,JBL Endurance RunBT IPX5 Sports Bluetooth Headset,"Black, Grey, In the Ear",4.0,9253,2049,3152,35,Bluetooth Headset,JBL,In the Ear,Black Grey,1103
217,REDMI YDJC01JY Wired Headset,"Black, In the Ear",3.1,139,399,596,33,Wired Headset,REDMI,In the Ear,Black,197
218,OPPO Buds 2 Wired Headset 0054154 Wired Headset,"Black, In the Ear",3.1,16,249,566,56,Wired Headset,OPPO,In the Ear,Black,317
219,Boult Audio ProBass Space Bluetooth Headset,"Black, Grey, In the Ear",3.2,6177,699,3329,79,Bluetooth Headset,Boult,In the Ear,Black Grey,2630
220,OPPO MH-139 MODEL WITH MIC PACK OF 2 Wired Headset,"White, In the Ear",3.5,204,199,995,80,Wired Headset,OPPO,In the Ear,White,796
221,OPPO Enco W31 ETI11 / ETI112 Bluetooth Headset,"Black, True Wireless",4.1,1407,3499,5931,41,Bluetooth Headset,OPPO,True Wireless,Black,2432
222,Skullcandy Ink'd Headset with mic,"Standard Issue, In the Ear",4.0,172741,925,1682,45,with mic,Skullcandy,In the Ear,Standard Issue,757
223,ViVO White_Buds Wired Headset,"White, In the Ear",3.6,387,199,349,43,Wired Headset,ViVO,In the Ear,White,150
224,REDMI Original High Bass Sound stereo Headphone 02 Wire...,"White, In the Ear",3.7,81,249,498,50,,REDMI,In the Ear,White,249
225,ViVO XE 680 High Bass Sound stereo Wired Headset,"White, In the Ear",3.4,502,191,796,76,Wired Headset,ViVO,In the Ear,White,605
226,JBL Endurance RunBT IPX5 Sports Bluetooth Headset,"Green, Black, Yellow, In the Ear",4.0,9253,1999,3173,37,Bluetooth Headset,JBL,In the Ear,Green Black Yellow,1174
227,SONY WI-C310 Bluetooth Headset,"Blue, In the Ear",4.1,7964,2749,2988,8,Bluetooth Headset,SONY,In the Ear,Blue,239
228,Skullcandy Jib Headset with mic,"Black, In the Ear",4.0,59306,768,997,23,with mic,Skullcandy,In the Ear,Black,229
229,Boult Audio X1 Wired Headset,"Blue Black, In the Ear",4.2,87152,299,997,70,Wired Headset,Boult,In the Ear,Blue Black,698
230,SONY WI-XB400 Extra Bass Wireless Stereo Headset Blueto...,"Blue, In the Ear",4.1,2043,3990,4988,20,,SONY,In the Ear,Blue,998
231,JBL Quantum 100 Wired Gaming Headset,"Blue, On the Ear",4.1,329,2599,3998,35,Gaming Headset,JBL,On the Ear,Blue,1399
232,JBL Quantum 50 Wired Gaming Headset,"Black, Orange, In the Ear",4.0,136,1499,2498,40,Gaming Headset,JBL,In the Ear,Black Orange,999
233,OPPO Enco W51 with Active Noise Cancellation Bluetooth ...,"Starry Blue, True Wireless",4.1,1248,4999,6943,28,,OPPO,True Wireless,Starry Blue,1944
234,"Portronics Harmonics Twins 33, POR-1175 Bluetooth Heads...","White, True Wireless",4.0,651,1499,3486,57,,Portronics,True Wireless,White,1987
235,SONY EX15AP Wired Headset,"Blue, In the Ear",4.0,8065,872,890,2,Wired Headset,SONY,In the Ear,Blue,18
236,Skullcandy Ink'd Headset with mic,"Black & Red, In the Ear",4.0,172743,959,1682,43,with mic,Skullcandy,In the Ear, Red,723
237,JBL T165BT Bluetooth Headset,"Blue, In the Ear",3.8,3027,1749,2691,35,Bluetooth Headset,JBL,In the Ear,Blue,942
238,HRX X-Wave 14R with Bass Boost Mode Bluetooth Headset,"Comet Red, In the Ear",3.7,777,1599,2961,46,Bluetooth Headset,HRX,In the Ear,Comet Red,1362
239,PHILIPS UpBeat TAUH202BK Wireless Bluetooth Headset,"Black, On the Ear",4.0,225,2499,3288,24,Bluetooth Headset,PHILIPS,On the Ear,Black,789
240,SONY AS210AP SPORTS Wired Headset,"Black, In the Ear",4.2,7413,1099,1278,14,Wired Headset,SONY,In the Ear,Black,179
241,Boult Audio BassBuds X2 Wired Headset,"Red, In the Ear",3.6,1039,299,1196,75,Wired Headset,Boult,In the Ear,Red,897
242,SONY WI-SP510 Bluetooth Headset,"Black, In the Ear",4.0,986,4875,6964,30,Bluetooth Headset,SONY,In the Ear,Black,2089
243,OPPO Enco W31 ETI11 / ETI112 Bluetooth Headset,"White, True Wireless",4.1,1408,3499,5931,41,Bluetooth Headset,OPPO,True Wireless,White,2432
244,JBL Endurance Run Wired Headset,"Teal, In the Ear",4.3,27456,1149,1596,28,Wired Headset,JBL,In the Ear,Teal,447
245,SONY EX155AP Wired Headset,"Light Blue, In the Ear",4.2,17465,1270,1283,1,Wired Headset,SONY,In the Ear,Light Blue,13
246,SONY EX155 Wired Headset,"Red, In the Ear",4.2,17465,1099,1278,14,Wired Headset,SONY,In the Ear,Red,179
247,Boult Audio ProBass Muse Bluetooth Headset,"Black, In the Ear",3.7,2908,799,3474,77,Bluetooth Headset,Boult,In the Ear,Black,2675
248,ViVO 3 Wired Headset,"White, In the Ear",3.6,218,199,905,78,Wired Headset,ViVO,In the Ear,White,706
249,boAt Rockerz 305v2 Bluetooth Headset,"Active Black, In the Ear",3.8,247,1599,3900,59,Bluetooth Headset,boAt,In the Ear,Active Black,2301
250,SONY WI-SP510 Bluetooth Headset,"Blue, In the Ear",4.0,986,4990,6931,28,Bluetooth Headset,SONY,In the Ear,Blue,1941
251,SONY EX155 Wired Headset,"Black, In the Ear",4.2,17465,1225,1289,5,Wired Headset,SONY,In the Ear,Black,64
252,Mivi DuoPods M80 True Wireless Bluetooth Earbuds with Q...,"Black, True Wireless",4.0,1489,2999,5998,50,,Mivi,True Wireless,Black,2999
253,ViVO EARPHONE SKS 301 Wired Headset,"White, In the Ear",4.0,13,193,965,80,Wired Headset,ViVO,In the Ear,White,772
254,boAt Airdopes 412 Bluetooth Headset,"Black, True Wireless",3.9,3604,2999,7498,60,Bluetooth Headset,boAt,True Wireless,Black,4499
255,Boult Audio ProBass Muse Bluetooth Headset,"Red, Black, In the Ear",3.7,2908,799,3474,77,Bluetooth Headset,Boult,In the Ear,Red Black,2675
256,JBL T110 Pure Bass Wired Headset,"Blue, In the Ear",4.1,6144,749,1291,42,Wired Headset,JBL,In the Ear,Blue,542
257,OPPO EXTRA BAZZ EARPHONE FOR ALL MOBILE Wired Headset W...,"Black, In the Ear",3.6,87,230,697,67,,OPPO,In the Ear,Black,467
258,JBL T50HI Wired Headset,"Blue, In the Ear",4.1,8041,649,998,35,Wired Headset,JBL,In the Ear,Blue,349
259,SONY C400 Bluetooth Headset,"Blue, In the Ear",4.0,12375,3499,3976,12,Bluetooth Headset,SONY,In the Ear,Blue,477
260,Mivi TEDPM40-BK Bluetooth Headset,"Black, True Wireless",4.0,666,1999,3998,50,Bluetooth Headset,Mivi,True Wireless,Black,1999
261,boAt Rockerz 315 SVA with Google Assistant Bluetooth He...,"Active Black, In the Ear",3.8,1621,1999,3447,42,,boAt,In the Ear,Active Black,1448
262,boAt Rockerz 240 Bluetooth Headset,"Red, In the Ear",4.1,5461,1399,2454,43,Bluetooth Headset,boAt,In the Ear,Red,1055
263,HRX X-Wave 11R with Flex Fold Design Technology Bluetoo...,"Venus Green, In the Ear",3.8,197,1199,2262,47,,HRX,In the Ear,Venus Green,1063
264,ORAIMO Free Pods 2S TWS True Wireless Half In-Ear Earbu...,"White, True Wireless",4.2,126,1599,3263,51,,ORAIMO,True Wireless,White,1664
265,OPPO COMBO EARPHONE (PACK OF 2) 3.5 MM WIRED HEADSET Wi...,"White, In the Ear",3.5,365,249,498,50,,OPPO,In the Ear,White,249
266,boAt Rockerz 560 Bluetooth Headset,"Active Black, On the Ear",3.7,1991,1899,3956,52,Bluetooth Headset,boAt,On the Ear,Active Black,2057
267,JBL T100TWS Bluetooth Headset,"Black, True Wireless",3.6,403,4099,7883,48,Bluetooth Headset,JBL,True Wireless,Black,3784
268,Sony MDR-AS210 Open-Ear Active Sports Headphones,Black,4.1,17225,750,789,5,Sports Headphones,Sony,,,39
269,Mivi BE5CL-GN Bluetooth Headset,"Green, In the Ear",3.8,9799,999,2938,66,Bluetooth Headset,Mivi,In the Ear,Green,1939
270,JBL T450BT Extra Bass Bluetooth Headset,"White, On the Ear",4.2,66192,2499,3471,28,Bluetooth Headset,JBL,On the Ear,White,972
271,ORAIMO Neckband Bluetooth Headphones with Mic Bluetooth...,"Black, In the Ear",3.9,660,1999,3447,42,,ORAIMO,In the Ear,Black,1448
272,Mivi Duopods M40 Bluetooth Headset,"Carmine, True Wireless",4.0,666,1899,3956,52,Bluetooth Headset,Mivi,True Wireless,Carmine,2057
273,ViVO Phone Wireless Bluetooth In-Ear Headphones Bluetoo...,"Black, In the Ear",3.5,77,325,591,45,,ViVO,In the Ear,Black,266
274,JBL Tune 125BT Bluetooth Headset,"Grey, In the Ear",3.8,759,1699,2981,43,Bluetooth Headset,JBL,In the Ear,Grey,1282
275,boAt Airdopes 201 Earbuds Bluetooth Headset,"Furious Blue, True Wireless",4.0,37611,1999,3998,50,Bluetooth Headset,boAt,True Wireless,Furious Blue,1999
276,ViVO New stylist Bluetooth Headset,"Black, In the Ear",3.1,294,399,1174,66,Bluetooth Headset,ViVO,In the Ear,Black,775
277,boAt Airdopes 381 Bluetooth Headset,"Active Black, True Wireless",3.7,13917,1999,4876,59,Bluetooth Headset,boAt,True Wireless,Active Black,2877
278,boAt Airdopes 201 Earbuds Bluetooth Headset,"Raging Red, True Wireless",4.0,37611,1899,3956,52,Bluetooth Headset,boAt,True Wireless,Raging Red,2057
279,boAt Airdopes 631 Bluetooth Headset,"Yellow, Blue, True Wireless",3.3,691,3999,6895,42,Bluetooth Headset,boAt,True Wireless,Yellow Blue,2896
280,Portronics POR-1102 Harmonics Klip 4 Retractable Blueto...,"Black, In the Ear",4.0,84,1499,1999,25,,Portronics,In the Ear,Black,500
281,HRX X-Streak 5Q Wired Headset,"Black, In the Ear",3.6,117,396,591,33,Wired Headset,HRX,In the Ear,Black,195
282,PHILIPS TAT4205BK (TWS) with IPX5 Splash-Proof Design B...,"Black, True Wireless",3.9,40,3999,6895,42,,PHILIPS,True Wireless,Black,2896
283,JBL Quantum 50 Wired Gaming Headset,"Purple, Red, In the Ear",4.0,138,1499,2498,40,Gaming Headset,JBL,In the Ear,Purple Red,999
284,ViVO best selling top attitude earphonne with mic Wired...,"White, In the Ear",3.5,2232,189,822,77,,ViVO,In the Ear,White,633
285,OPPO BEST SOUND EARPHONE WITH MIC Wired Headset,"Black, In the Ear",3.7,76,237,790,70,Wired Headset,OPPO,In the Ear,Black,553
286,JBL T500 Bluetooth Headset,"Black, On the Ear",4.3,2653,2899,3765,23,Bluetooth Headset,JBL,On the Ear,Black,866
287,JBL T100TWS Bluetooth Headset,"White, True Wireless",3.6,403,3999,7998,50,Bluetooth Headset,JBL,True Wireless,White,3999
288,ViVO Rock Extra Bass in-Ear Sound Headphones with Mic 3...,"Black, In the Ear",3.7,236,243,736,67,,ViVO,In the Ear,Black,493
289,JBL Endurance Run Wired Headset,"Blue, In the Ear",4.3,27456,1139,1519,25,Wired Headset,JBL,In the Ear,Blue,380
290,JBL Original T50HI Black Wired Headset,"Black, In the Ear",3.8,10,699,999,30,Wired Headset,JBL,In the Ear,Black,300
291,PHILIPS Upbeat TAN2215BK Bluetooth Headset,"Black, In the Ear",3.9,45,1890,3938,52,Bluetooth Headset,PHILIPS,In the Ear,Black,2048
292,Mivi ThunderBeats Bluetooth Headset,"Red, In the Ear",3.9,27363,1234,2468,50,Bluetooth Headset,Mivi,In the Ear,Red,1234
293,Skullcandy Sesh Evo Bluetooth Headset,"Chill Gray, True Wireless",4.0,80,4999,9998,50,Bluetooth Headset,Skullcandy,True Wireless,Chill Gray,4999
294,Skullcandy S2JPW-M003 Bluetooth Headset,"Black, In the Ear",3.6,157,1633,2474,34,Bluetooth Headset,Skullcandy,In the Ear,Black,841
295,OPPO Originol- Earphone-Headphone Wired Headset,"White, In the Ear",3.4,280,185,1423,87,Wired Headset,OPPO,In the Ear,White,1238
296,ViVO universal earphone Wired Headset,"White, In the Ear",3.4,631,249,996,75,Wired Headset,ViVO,In the Ear,White,747
297,JBL Quantum 200 Wired Gaming Headset,"Black, On the Ear",4.1,337,3799,5936,36,Gaming Headset,JBL,On the Ear,Black,2137
298,SONY EX15AP Wired without Mic Headset,"Black, In the Ear",4.0,8065,875,884,1,Mic Headset,SONY,In the Ear,Black,9
299,ORAIMO OEB-E59D Bluetooth Headset,"Black, In the Ear",4.2,53,1079,1686,36,Bluetooth Headset,ORAIMO,In the Ear,Black,607
300,JBL Quantum 300 Wired Gaming Headset,"Black, On the Ear",3.8,91,4699,6910,32,Gaming Headset,JBL,On the Ear,Black,2211
301,Boult Audio X1-WL Bluetooth Headset,"Red, In the Ear",4.0,718,899,2997,70,Bluetooth Headset,Boult,In the Ear,Red,2098
302,Skullcandy Ink'd Headset with mic,"Blue & Black, In the Ear",4.0,172743,959,1682,43,with mic,Skullcandy,In the Ear, Black,723
303,OPPO EARPHONE COMPATIBLE WITH ALL MODELS Wired Headset,"White, In the Ear",3.5,699,217,493,56,Wired Headset,OPPO,In the Ear,White,276
304,JBL T50HI Wired Headset,"Black, In the Ear",4.1,8041,649,998,35,Wired Headset,JBL,In the Ear,Black,349
305,SONY WI-XB400 Bluetooth Headset,"Black, In the Ear",4.1,568,3625,4966,27,Bluetooth Headset,SONY,In the Ear,Black,1341
306,ViVO High Bass Earphones Noise Isolating 007 Wired Head...,"White, In the Ear",3.4,844,217,493,56,,ViVO,In the Ear,White,276
307,Boult Audio Airbass Truebuds Bluetooth Headset,"Grey, True Wireless",3.9,7356,1999,7996,75,Bluetooth Headset,Boult,True Wireless,Grey,5997
308,Skullcandy Spoke Bluetooth Headset,"Black, True Wireless",3.7,159,2390,7967,70,Bluetooth Headset,Skullcandy,True Wireless,Black,5577
309,SONY EX255AP Wired Headset,"Blue, In the Ear",4.2,2695,1699,1976,14,Wired Headset,SONY,In the Ear,Blue,277
310,OPPO Enco W51 with Active Noise Cancellation Bluetooth ...,"Floral White, True Wireless",4.1,1249,4999,6943,28,,OPPO,True Wireless,Floral White,1944
311,PHILIPS SHE1405BK/94 Wired Headset,"Black, In the Ear",3.9,29362,399,443,10,Wired Headset,PHILIPS,In the Ear,Black,44
312,Mivi DuoPods M80 True Wireless Bluetooth Headset with a...,"White, True Wireless",4.0,1489,2999,5998,50,,Mivi,True Wireless,White,2999
313,ViVO Bass Headset with good sound cliarity Wired Headse...,"Black, In the Ear",3.5,299,235,758,69,,ViVO,In the Ear,Black,523
314,Portronics POR-1050 Harmonics Twins II True Wireless Bl...,"Black, True Wireless",3.6,16,1749,3975,56,,Portronics,True Wireless,Black,2226
315,ViVO original xe680 white wired Wired Headset,"White, In the Ear",3.3,127,217,835,74,Wired Headset,ViVO,In the Ear,White,618
316,Portronics POR-325 Harmonics Twins Mini Bluetooth Heads...,"Black, True Wireless",4.1,3642,1699,3467,51,,Portronics,True Wireless,Black,1768
317,boAt Rockerz 450 Pro Bluetooth Headset,"Hazel Beige, On the Ear",4.2,1116,1999,3920,49,Bluetooth Headset,boAt,On the Ear,Hazel Beige,1921
318,boAt 100 Wireless Bluetooth Headset,"Maroon, In the Ear",4.1,14443,1499,2998,50,Bluetooth Headset,boAt,In the Ear,Maroon,1499
319,JBL Tune 125BT Bluetooth Headset,"Red, In the Ear",3.8,759,1699,2981,43,Bluetooth Headset,JBL,In the Ear,Red,1282
320,Skullcandy S2DUY-L102 JIB Wired Headset,"GREEN BLACK, In the Ear",4.3,3,799,999,20,Wired Headset,Skullcandy,In the Ear,GREEN BLACK,200
321,OPPO With Deep Bass Original Wired Headphone Wired Head...,"White, In the Ear",3.6,616,195,975,80,,OPPO,In the Ear,White,780
322,Boult Audio Air Bass Power Buds Bluetooth Headset,"Blue, Black, True Wireless",3.9,1038,2199,8796,75,Bluetooth Headset,Boult,True Wireless,Blue Black,6597
323,SONY C400 Bluetooth Headset,"Red, In the Ear",4.0,12375,3499,3976,12,Bluetooth Headset,SONY,In the Ear,Red,477
324,Skullcandy Uproar Bluetooth Headset with Mic,"Blue, On the Ear",4.3,17122,2825,5433,48,with Mic,Skullcandy,On the Ear,Blue,2608
325,SONY XB450AP Wired Headset,"Red, On the Ear",4.3,9485,2099,2469,15,Wired Headset,SONY,On the Ear,Red,370
326,OPPO Stylist Bluetooth Headset,"Black, In the Ear",3.3,22,389,997,61,Bluetooth Headset,OPPO,In the Ear,Black,608
327,Skullcandy Jib Headset with mic,"White, In the Ear",4.0,59305,780,987,21,with mic,Skullcandy,In the Ear,White,207
328,Skullcandy Ink'd Plus Wired Headset,"Blue, In the Ear",3.6,60,999,1491,33,Wired Headset,Skullcandy,In the Ear,Blue,492
329,OPPO Earphone with Powerful Super Bass Wired Headset Wi...,"Black, In the Ear",3.8,40,247,494,50,,OPPO,In the Ear,Black,247
330,Skullcandy S2DUL-J319 Wired Headset,"Hot Lime/Grey, In the Ear",4.0,91234,679,1095,38,Wired Headset,Skullcandy,In the Ear,Grey,416
331,ViVO New Arrival Mini Bluetooth headphone Bluetooth Hea...,"Black, True Wireless",3.8,10,369,997,63,,ViVO,True Wireless,Black,628
332,ORAIMO OEB-E75D Bluetooth Headset,"Black, In the Ear",3.8,10,1699,2981,43,Bluetooth Headset,ORAIMO,In the Ear,Black,1282
333,JBL T110BT Bluetooth Headset,"Blue, In the Ear",3.9,28088,1789,2485,28,Bluetooth Headset,JBL,In the Ear,Blue,696
334,Boult Audio BassBuds X2 Wired Headset,"Black, In the Ear",3.6,1039,299,1196,75,Wired Headset,Boult,In the Ear,Black,897
335,Skullcandy Uproar Bluetooth Headset with Mic,"Grey Black, On the Ear",4.3,17122,2825,5433,48,with Mic,Skullcandy,On the Ear,Grey Black,2608
336,ViVO Best Bass bluetooth Bluetooth Headset,"bluetooth, In the Ear",3.1,152,395,1197,67,Bluetooth Headset,ViVO,In the Ear,bluetooth,802
337,Mivi Rock and Roll W1 Wired Earphones with HD Sound and...,"Red, In the Ear",3.1,916,399,798,50,,Mivi,In the Ear,Red,399
338,HRX X-Wave 11R with Flex Fold Design Technology Bluetoo...,"Asteroid Red, In the Ear",3.8,197,1199,2262,47,,HRX,In the Ear,Asteroid Red,1063
339,boAt Airdopes 201 Earbuds Bluetooth Headset,"Viper Green, True Wireless",4.0,37611,1999,3998,50,Bluetooth Headset,boAt,True Wireless,Viper Green,1999
340,ORAIMO SHARK 2 (59D) WIRELESS HEADPHONE Bluetooth Heads...,"Black, In the Ear",3.6,47,1183,1690,30,,ORAIMO,In the Ear,Black,507
341,SONY MDR-XB450AP_Red Wired Headset,"Red, On the Ear",4.5,126,2355,2479,5,Wired Headset,SONY,On the Ear,Red,124
342,ViVO EARPHONE Y20' NOTE9 S1 Wired Headset,"White, In the Ear",3.3,68,217,658,67,Wired Headset,ViVO,In the Ear,White,441
343,Skullcandy Ink'd Bluetooth Headset with Mic,"Red/Black, In the Ear",4.1,46558,2999,3999,25,with Mic,Skullcandy,In the Ear,Black,1000
344,ViVO STYLIST BLACK GOLDEN EARPHONE FOR EVERYONE Wired w...,"Black, In the Ear",3.0,10,499,1085,54,,ViVO,In the Ear,Black,586
345,JBL Tune 700BT Bluetooth Headset,"Blue, On the Ear",4.0,214,4499,4999,10,Bluetooth Headset,JBL,On the Ear,Blue,500
346,OPPO 2 Wired Headset Wired Headset,"Black, In the Ear",3.0,69,240,686,65,Wired Headset,OPPO,In the Ear,Black,446
347,Skullcandy S2DUL-J335 Wired Headset,"Red/Black, In the Ear",4.0,91234,679,1095,38,Wired Headset,Skullcandy,In the Ear,Black,416
348,REDMI Original High Bass Sound stereo00 Headphone Wired...,"White, In the Ear",3.5,28,249,498,50,,REDMI,In the Ear,White,249
349,JBL T205 Wired Headset,"Black, In the Ear",3.9,16747,999,1586,37,Wired Headset,JBL,In the Ear,Black,587
350,OPPO OpoCearphone Wired Headset,"White, In the Ear",3.4,142,217,395,45,Wired Headset,OPPO,In the Ear,White,178
351,JBL Tune 700BT Bluetooth Headset,"Black, On the Ear",4.0,214,4499,4999,10,Bluetooth Headset,JBL,On the Ear,Black,500
352,OPPO R9 WIRED HEADSET PACK OF 2 Wired Headset,"White, In the Ear",3.5,238,249,593,58,Wired Headset,OPPO,In the Ear,White,344
353,ViVO Stylist Earphone with mic (white) Wired Headset,"White, In the Ear",3.4,2001,199,995,80,Wired Headset,ViVO,In the Ear,White,796
354,OPPO Ear Wired Earphones with Mic(white) Wired Headset,"White, In the Ear",3.4,138,217,395,45,Wired Headset,OPPO,In the Ear,White,178
355,SONY EX15AP Wired Headset,"Voilet, In the Ear",4.0,8065,885,1770,50,Wired Headset,SONY,In the Ear,Voilet,885
356,OPPO ORIGINAL 3.5MM COMBO PACK EARPHONE Wired Headset,"White, In the Ear",3.5,740,249,922,73,Wired Headset,OPPO,In the Ear,White,673
357,SONY C400 Bluetooth Headset,"White, In the Ear",4.0,12375,3499,3976,12,Bluetooth Headset,SONY,In the Ear,White,477
358,JBL T210 Wired without Mic Headset,"ROSE GOLD, In the Ear",4.1,11007,938,1187,21,Mic Headset,JBL,In the Ear,ROSE GOLD,249
359,JBL Endurance Run Wired Headset,"Red, In the Ear",4.3,27456,1049,1589,34,Wired Headset,JBL,In the Ear,Red,540
360,JBL Tune 110 Wired Headset,"Red, In the Ear",4.0,34170,727,1275,43,Wired Headset,JBL,In the Ear,Red,548
361,ViVO Combo of earph+pouch Wired Headset,"White, In the Ear",3.3,72,379,1458,74,Wired Headset,ViVO,In the Ear,White,1079
362,JBL Live 25BT Bluetooth Headset,"White, In the Ear",3.7,131,1949,4997,61,Bluetooth Headset,JBL,In the Ear,White,3048
363,JBL JBLT500BTWHT Bluetooth Headset,"White, On the Ear",4.3,2654,3299,3792,13,Bluetooth Headset,JBL,On the Ear,White,493
364,PHILIPS SHE4305 Wired Headset,"Red, In the Ear",4.1,77,698,1293,46,Wired Headset,PHILIPS,In the Ear,Red,595
365,Portronics Harmonics X Bluetooth Headset,"Grey, In the Ear",4.1,232,1199,1998,40,Bluetooth Headset,Portronics,In the Ear,Grey,799
366,REDMI Original High Bass Sound sterecyfyco Headphone 02...,"White, In the Ear",3.4,11,249,498,50,,REDMI,In the Ear,White,249
367,OPPO EARPHONE-003 MODEL WIRED HEADSET WITH MIC Wired He...,"White, In the Ear",3.5,336,249,958,74,,OPPO,In the Ear,White,709
368,ORAIMO E21 Wired Headset,"Black, In the Ear",3.8,21,275,348,21,Wired Headset,ORAIMO,In the Ear,Black,73
369,Skullcandy Jib Plus Wireless Bluetooth Headset,"Electric Yellow, In the Ear",3.4,236,1699,2499,32,Bluetooth Headset,Skullcandy,In the Ear,Electric Yellow,800
370,OPPO EARPHONE WIRED HEADSET Wired Headset Wired Headset,"White, In the Ear",3.3,97,158,395,60,Wired Headset,OPPO,In the Ear,White,237
371,Boult Audio Loop Wired Headset,"Blue, Black, In the Ear",4.1,77272,349,1163,70,Wired Headset,Boult,In the Ear,Blue Black,814
372,Skullcandy Jib Headset with mic,"White, In the Ear",4.0,59306,786,995,21,with mic,Skullcandy,In the Ear,White,209
373,boAt Rockerz 275v2 Bluetooth Headset,"Black, In the Ear",3.7,1739,1804,2957,39,Bluetooth Headset,boAt,In the Ear,Black,1153
374,JBL E25BT Bluetooth Headset,"Black, In the Ear",3.9,5439,2399,3477,31,Bluetooth Headset,JBL,In the Ear,Black,1078
375,ViVO Ear Universal Headphone wIth Mic Wired Headset,"White, In the Ear",3.5,116,170,944,82,Wired Headset,ViVO,In the Ear,White,774
376,SONY WI-C310 Bluetooth Headset,"Gold, In the Ear",4.1,7964,2799,2978,6,Bluetooth Headset,SONY,In the Ear,Gold,179
377,REDMI Basic Wired Headset with Mic 01SDFDFGGDFTDYFGTDJ ...,"Blue, In the Ear",2.7,56,299,598,50,,REDMI,In the Ear,Blue,299
378,ViVO NEW STYLIST BLACK LOVE Wired Headset,"Black, In the Ear",3.8,48,245,1167,79,Wired Headset,ViVO,In the Ear,Black,922
379,JBL JBLLIVE200BTRED Bluetooth Headset,"Red, In the Ear",3.7,4603,3549,5297,33,Bluetooth Headset,JBL,In the Ear,Red,1748
380,ViVO EARPONE COMPATIBLE WITH ALL MODELS Wired Headset ....,"White, In the Ear",3.4,30,249,579,57,,ViVO,In the Ear,White,330
381,boAt Airdopes 501 Bluetooth Headset,"Spirit Lime, True Wireless",3.8,2012,2999,4998,40,Bluetooth Headset,boAt,True Wireless,Spirit Lime,1999
382,ORAIMO OEB-E99D Bluetooth Headset,"Black, True Wireless",3.7,387,4599,9198,50,Bluetooth Headset,ORAIMO,True Wireless,Black,4599
383,PHILIPS SHE4305WT/00 Wired Headset,"White, In the Ear",3.9,4135,649,1298,50,Wired Headset,PHILIPS,In the Ear,White,649
384,SONY XB450 Wired without Mic Headset,"Black, On the Ear",4.3,27503,1990,2187,9,Mic Headset,SONY,On the Ear,Black,197
385,SONY XB75 Wired Headset,"Black, In the Ear",4.2,1279,3990,7980,50,Wired Headset,SONY,In the Ear,Black,3990
386,Portronics POR-1146 Conch Delta Wired Headset,"White, In the Ear",3.7,277,233,395,41,Wired Headset,Portronics,In the Ear,White,162
387,JBL LIVE200BT Wireless In-Ear Neckband Bluetooth Headse...,"Green, In the Ear",3.7,4603,3699,5284,30,,JBL,In the Ear,Green,1585
388,JBL T50HI Wired Headset,"Red, In the Ear",4.1,8042,649,998,35,Wired Headset,JBL,In the Ear,Red,349
389,OPPO Earph-013 Wired Headset,"White, In the Ear",3.4,286,217,493,56,Wired Headset,OPPO,In the Ear,White,276
